event_name,stakeholder,text_summary,sentiment,keywords,date
Climate Summit,Government,Government stresses cooperation and long-term climate agreements.,0.45,"agreement, targets, cooperation",2023-11-15
Climate Summit,Media,Media emphasizes mixed reactions and different negotiation outcomes.,0.02,"reactions, negotiation, outcomes",2023-11-15
Climate Summit,Public,Public expresses hope but also frustration about slow progress.,-0.18,"hope, frustration, progress",2023-11-15
AI Regulation,Government,Government highlights AI innovation and safety frameworks.,0.32,"innovation, safety, framework",2024-02-10
AI Regulation,Media,Media reports on heated debates about regulation speed.,-0.22,"risk, debate, speed",2024-02-10
AI Regulation,Public,Public discussions show uncertainty and cautious optimism.,0.00,"uncertainty, optimism, discussion",2024-02-10
World Cup Final,Government,Government congratulates athletes and focuses on national pride.,0.52,"pride, celebration, unity",2022-12-18
World Cup Final,Media,Media covers intense match moments and controversial decisions.,-0.14,"drama, controversy, intensity",2022-12-18
World Cup Final,Public,Public reactions include excitement and a calm appreciation of the match.,0.03,"reaction, appreciation, calm",2022-12-18
